{"apiVersion":"kernel-zero.dev/custody/v1","integrity":{"algorithm":"sha256","digest":"sha256:5555555555555555555555555555555555555555555555555555555555555555"},"keys":[{"crv":"Ed25519","keyId":"workspace-authority-1","kty":"OKP","revokedFrom":null,"validFrom":"2026-01-01T00:00:00.000Z","validUntil":null,"x":"AAAAAAAAAAAAAAAAAAAAAAAAAAAAAAAAAAAAAAAAAAA"}],"kind":"WorkspaceTrustBundle","revision":1,"workspace":"0195f000-0000-7000-8000-000000000002"}
